icd9_code,short_title,long_title
V5423,Aftercare path fx hip,Aftercare for healing pathologic fracture of hip
V5426,Aftrcare path fx low leg,Aftercare for healing pathologic fracture of lower leg
V5427,Aftrcare path fx vertebr,Aftercare for healing pathologic fracture of vertebrae
V5481,Aftercare joint replace,Aftercare following joint replacement
V5482,Aftcr explantatn jt pros,Aftercare following explantation of joint prosthesis
V5489,Orthopedic aftercare NEC,Other orthopedic aftercare
V549,Orthopedic aftercare NOS,Unspecified orthopedic aftercare
V550,Atten to tracheostomy,Attention to tracheostomy
V551,Atten to gastrostomy,Attention to gastrostomy
V552,Atten to ileostomy,Attention to ileostomy
V553,Atten to colostomy,Attention to colostomy
V554,Atten to enterostomy NEC,Attention to other artificial opening of digestive tract
V555,Atten to cystostomy,Attention to cystostomy
V556,Atten to urinostomy NEC,Attention to other artificial opening of urinary tract
V558,Attn to artif open NEC,Attention to other specified artificial opening
V560,Renal dialysis encounter,Encounter for extracorporeal dialysis
V561,Ft/adj xtrcorp dial cath,Fitting and adjustment of extracorporeal dialysis catheter
V562,Fit/adj perit dial cath,Fitting and adjustment of peritoneal dialysis catheter
V568,"Dialysis encounter, NEC",Encounter for other dialysis
V580,Radiotherapy encounter,Encounter for radiotherapy
V5811,Antineoplastic chemo enc,Encounter for antineoplastic chemotherapy
V5812,Immunotherapy encounter,Encounter for antineoplastic immunotherapy
V5831,Attn rem surg dressing,Encounter for change or removal of surgical wound dressing
V5841,Encntr plnd po wnd clsr,Encounter for planned post-operative wound closure
V5842,Aftercare neoplasm surg,Aftercare following surgery for neoplasm
V5843,Aftrcare inj/trauma surg,Aftercare following surgery for injury and trauma
V5844,Aftercare organ transplt,Aftercare following organ transplant
V5849,Postop oth specfd aftrcr,Other specified aftercare following surgery
V5861,Long-term use anticoagul,Long-term (current) use of anticoagulants
V5862,Long-term use antibiotic,Long-term (current) use of antibiotics
V5863,Lng use antiplte/thrmbtc,Long-term (current) use of antiplatelet/antithrombotic
V5864,Long-term anti-inflamtry,Long-term (current) use of non-steroidal anti-inflammatories (NSAID)
V5865,Long-term use steroids,Long-term (current) use of steroids
V5866,Long-term use of aspirin,Long-term (current) use of aspirin
V5867,Long-term use of insulin,Long-term (current) use of insulin
V5869,Long-term use meds NEC,Long-term (current) use of other medications
V5873,Aft surg circ syst NEC,"Aftercare following surgery of the circulatory system, NEC"
V5881,Fit/adj vascular cathetr,Fitting and adjustment of vascular catheter
V5883,Therapeutic drug monitor,Encounter for therapeutic drug monitoring
V596,Liver donor,Liver donors
V600,Lack of housing,Lack of housing
V601,Inadequate housing,Inadequate housing
V602,Economic problem,Inadequate material resources
V604,No family able to care,No other household member able to render care
V6103,Fmily dsrpt- divorce/sep,Family disruption due to divorce or legal separation
V6104,Family dsrpt-estrangmemt,Family disruption due to parent-child estrangement
V6107,Family dsrpt-death membr,Family disruption due to death of family member
V6109,Family disruption NEC,Other family disruption
V6110,Consl partner prob,"Counseling for marital and partner problems, unspecified"
V6111,Cnsl victm partner abuse,Counseling for victim of spousal and partner abuse
V6129,Oth parent-child problem,Other parent-child problems
V6141,Alcoholism in family,Alcoholism in family
V6142,Substance abuse-family,Substance abuse in family
V6149,Family health probl NEC,Other health problems within the family
V618,Family circumstances NEC,Other specified family circumstances
V620,Unemployment,Unemployment
V624,Social maladjustment,Social maladjustment
V625,Legal circumstances,Legal circumstances
V626,Refusal of treatment,Refusal of treatment for reasons of religion or conscience
V6282,"Bereavement, uncomplicat","Bereavement, uncomplicated"
V6284,Suicidal ideation,Suicidal ideation
V6285,Homicidal ideation,Homicidal ideation
V6289,Psychological stress NEC,"Other psychological or physical stress, not elsewhere classified"
V632,Wait adm to oth facility,Person awaiting admission to adequate facility elsewhere
V638,No med facilities NEC,Other specified reasons for unavailability of medical facilities
V6405,No vaccin-caregiv refuse,Vaccination not carried out because of caregiver refusal
V6406,No vaccination-pt refuse,Vaccination not carried out because of patient refusal
V641,No proc/contraindication,Surgical or other procedure not carried out because of contraindication
V642,No proc/patient decision,Surgical or other procedure not carried out because of patient's decision
V643,No proc for reasons NEC,Procedure not carried out for other reasons
V6441,Lap surg convert to open,Laparoscopic surgical procedure converted to open procedure
V6442,Thoracoscop conv to open,Thoracoscopic surgical procedure converted to open procedure
V6443,Arthroscopc conv to open,Arthroscopic surgical procedure converted to open procedure
V652,Person feigning illness,Person feigning illness
V653,Dietary surveil/counsel,Dietary surveillance and counseling
V6542,Counslng sbstn use abuse,Counseling on substance use and abuse
V6549,Other specfd counseling,Other specified counseling
V655,Persn w feared complaint,Person with feared complaint in whom no diagnosis was made
V660,Surgical convalescence,Convalescence following surgery
V667,Encountr palliative care,Encounter for palliative care
V671,Radiotherapy follow-up,"Follow-up examination, following radiotherapy"
V672,Chemotherapy follow-up,"Follow-up examination, following chemotherapy"
V6889,Administrtve encount NEC,Encounters for other specified administrative purpose
V694,Lack of adequate sleep,Lack of adequate sleep
V698,Oth prblms rltd lfstyle,Other problems related to lifestyle
V703,Med exam NEC-admin purp,Other general medical examination for administrative purposes
V707,Exam-clincal trial,Examination of participant in clinical trial
V708,General medical exam NEC,Other specified general medical examinations
V714,Observ-accident NEC,Observation following other accident
V716,Observ-inflicted inj NEC,Observation following other inflicted injury
V7219,Exam ears & hearing NEC,Other examination of ears and hearing
V7281,Preop cardiovsclr exam,Pre-operative cardiovascular examination
V741,Screening-pulmonary TB,Screening examination for pulmonary tuberculosis
V7651,Screen malig neop-colon,Special screening for malignant neoplasms of colon
V789,Screen-blood dis NOS,Screening for unspecified disorder of blood and blood-forming organs
V812,Screen-cardiovasc NEC,Screening for other and unspecified cardiovascular conditions
V8381,Cystic fibrosis gene car,Cystic fibrosis gene carrier
V8389,Genetic carrier stat NEC,Other genetic carrier status
V8401,Genetc sus mal neo brest,Genetic susceptibility to malignant neoplasm of breast
V8409,Genetic susc mal neo NEC,Genetic susceptibility to other malignant neoplasm
V8489,Genetic suscept dis NEC,Genetic susceptibility to other disease
V850,"BMI less than 19,adult","Body Mass Index less than 19, adult"
V851,"BMI between 19-24,adult","Body Mass Index between 19-24, adult"
V8521,"BMI 25.0-25.9,adult","Body Mass Index 25.0-25.9, adult"
V8522,"BMI 26.0-26.9,adult","Body Mass Index 26.0-26.9, adult"
V8523,"BMI 27.0-27.9,adult","Body Mass Index 27.0-27.9, adult"
V8524,"BMI 28.0-28.9,adult","Body Mass Index 28.0-28.9, adult"
V8525,"BMI 29.0-29.9,adult","Body Mass Index 29.0-29.9, adult"
V8530,"BMI 30.0-30.9,adult","Body Mass Index 30.0-30.9, adult"
V8531,"BMI 31.0-31.9,adult","Body Mass Index 31.0-31.9, adult"
V8532,"BMI 32.0-32.9,adult","Body Mass Index 32.0-32.9, adult"
V8533,"BMI 33.0-33.9,adult","Body Mass Index 33.0-33.9, adult"
V8534,"BMI 34.0-34.9,adult","Body Mass Index 34.0-34.9, adult"
V8535,"BMI 35.0-35.9,adult","Body Mass Index 35.0-35.9, adult"
V8536,"BMI 36.0-36.9,adult","Body Mass Index 36.0-36.9, adult"
V8537,"BMI 37.0-37.9,adult","Body Mass Index 37.0-37.9, adult"
V8538,"BMI 38.0-38.9,adult","Body Mass Index 38.0-38.9, adult"
V8539,"BMI 39.0-39.9,adult","Body Mass Index 39.0-39.9, adult"
V8541,"BMI 40.0-44.9, adult","Body Mass Index 40.0-44.9, adult"
V8542,"BMI 45.0-49.9, adult","Body Mass Index 45.0-49.9, adult"
V8543,"BMI 50.0-59.9, adult","Body Mass Index 50.0-59.9, adult"
V8544,"BMI 60.0-69.9, adult","Body Mass Index 60.0-69.9, adult"
V8545,"BMI 70 and over, adult","Body Mass Index 70 and over, adult"
V860,Estrogen recep pstv stat,Estrogen receptor positive status [ER+]
V861,Estrogen recep neg stat,Estrogen receptor negative status [ER-]
V8709,Cntct/exp hazrd metl NEC,Contact with and (suspected) exposure to other hazardous metals
V872,Cont/exp hazard chem NEC,Contact with and (suspected) exposure to other potentially hazardous chemicals
V8741,Hx antineoplastic chemo,Personal history of antineoplastic chemotherapy
V8745,Hx systemc steroid thrpy,Personal history of systemic steroid therapy
V8801,Acq absnce cervix/uterus,Acquired absence of both cervix and uterus
V8811,Acq total absnc pancreas,Acquired total absence of pancreas
V8812,Acq part absnce pancreas,Acquired partial absence of pancreas
V8821,Acq absence of hip joint,Acquired absence of hip joint
V9010,Retained metal frag NOS,"Retained metal fragments, unspecified"
V902,Retain plastic fragments,Retained plastic fragments
V9039,Retain organic frag NEC,Other retained organic fragments
V9081,Retained glass fragments,Retained glass fragments
V9089,Retain FB NEC,Other specified retained foreign body
V9103,Twin gest-dich/diamniotc,"Twin gestation, dichorionic/diamniotic (two placentae, two amniotic sacs)"
